selftext,source,region,language
"Honestly, you can’t really expect to feel the same way you did with Aion 1, because it’s something that (maybe not for everyone, but for some of us) was there at the very start of our puberty. What I mean is that the emotions we felt back then as kids just aren’t the ones we’ll feel now as adults. You’ll feel nostalgia and other things, but probably not the exact same emotions.

That said, I’m beyond excited and can’t wait to see everything again (my inner child is screaming!) because I’ve seen how much things have improved compared to what was shown at the beginning, and now more than ever I just want time to fly so I can finally play it.

Please, keep putting your heart and passion into it and don’t let us down — at least not so much that history repeats itself ❤🙏🏻",youtube,국내,en
"The biggest mistake you'll make is to throw away all the worldwide hype by releasing it only in Korea again. We're not in 2002 anymore. People install VPNs, play the damn game, and get bored before it even launches.",youtube,국내,en
Have you had any gameplay footage of the mobile version? Another question: how aggressive will p2w be in this game?Obviously it will be p2w.,youtube,국내,en
Avrupa da ne zaman çıkacak,youtube,국내,tr
"НЕ ОТДАВАЙТЕ ИННОВЕ(4GAME) В ЛОКАЛИЗАЦИЮ,МОЛЮ!!!!!!!!!!!!!!!",youtube,국내,ru
wow,youtube,국내,en
Çıkış tarihi ne Zaman,youtube,국내,tr
global please,youtube,국내,en
NC can't fail. they are so good at creating MMORPGs. no other developers worthy of the competition.,youtube,국내,en
Let's go ❤️‍🔥🔥🥰,youtube,국내,en
This is the line of npc in NC's game blade and soul.,youtube,국내,en
@JIHUN-x9p oh i play bns (in english)! which npc said that?,youtube,국내,en
"I played Aion for many years and it marked an unforgettable part of my life. Ncsoft, I believe you can make Aion 2 shine just like the original did in its golden days. Please don’t repeat the same mistakes  let this game win our hearts again!",youtube,국내,en
This game should release global,youtube,국내,en
"Don't ruin the hype by releasing the game only in Korea and then a year later for the rest of the world, it's not 2002 anymore...",youtube,국내,en
It's 3.0 Aion first loading music if I recall correctly. I got goosebumps 😢😢😢😭,youtube,국내,en
It's going to be the absolute highlight of gaming for the MMORPG,youtube,국내,en
"دييييييييييييم 
ولله اشتقنا يا ايون مر 17 سنه",youtube,국내,fa
16M views with only 800 likes and 270 comments? xD,youtube,국내,en
"Ребята из NCsoft, не забывайте про русское комьюнити. У нас очень много фанатов Aion и linage. Все очень ждут релиза Aion. Сделайте хотя бы перевод интерфейса. Обещаю купить батл пасс и все что скажите 😂",youtube,국내,ru
"Супер, очень жду выхода в России",youtube,국내,ru
stick to your words and that's all,youtube,국내,en
"Yes, a lot of players are waiting for Aion 2. It’s a shame that NCsoft isn’t making any effort to translate the content into English, so we have to rely on kind people to help us understand what’s going on. They’re going to make money from the US, EU, and RU player base, so they could at least take a bit better care of us. Still, we’re excited to step into the world of Aion once again—let’s just hope the monetization systems won’t be too aggressive, and that the game will thrill us like the first one did.",youtube,국내,en
Hurray! My heart is beating so hard! I love this music.💓,youtube,국내,en
Remove the Korean phone number requirement to play the game. I’ll play the game even if it’s in Korean until there’s an English patch / translated to English.,youtube,국내,en
"It will middle of next year, just in time for me to collect it enough money for decent pc",youtube,국내,en
I'm german and I loved it in 2009-2010. Just a unique game with one of the best soundtracks to ever exist. It was really sad that the game lost most players end of 2010.,youtube,국내,en
❤🎉  cant't wait release in Germany 😍,youtube,국내,en
"Ncsoft dont make this game a p2w bullshit, otherwise it will end up like all your other game like the OG Aion / blade and soul *poor thing had such potential*....and so many more of your Ips. 
I really hope you learned from your past error and make a great game.
Thanks from an old Aion/Lineage 2 player",youtube,국내,en
You gotta wait till next year to play the NA version but by then rip. Wish they would release both versions of the game at the same time.,youtube,국내,en
they already made many mistakes,youtube,국내,en
will it come to global?,youtube,국내,en
global release 19 November too ?,youtube,국내,en
Korea 😢,youtube,국내,en
maybe its ads,youtube,국내,en
TURKLER NERDESIDNBBIZ,youtube,국내,en
Красиво,youtube,국내,mk
GLOBAL RELEASE AT THE SAME TIME OTHERWISE DEAD GAME,youtube,국내,en
"Yea the problem is it’s gonna be like Throne and Liberty where all the people who already know what they’re doing are gonna play KR then play NA and pretend to be “new players” who are good at the game lol. 

Might as well release it earlier even if it’s in Korean for the time being for everyone. For now you need a Korean number to play the game which is lame.",youtube,국내,en
​@nebojsakelebuda6072also good thing that during korean live they will patch and balance what needs to be fixed.  Which is good,youtube,국내,en
In Korea it is November 19th and globally it is 2026 or 2027.,youtube,국내,en
most disgusting game commercial ever seen.,youtube,국내,en
Nice try but it didnt work well for you.,youtube,국내,en
I`m waiting Lineage 3,youtube,국내,en
Sera-t-il meilleur que le 1er ? Devrons-nous baisser le graphisme au max lors de raid PvP pour atteindre héroïquement les 19 IPS ? Nous le saurons bientôt...,youtube,국내,fr
❤ GLOBAL BRAZIL PLEASE ❤799,youtube,국내,en
Pour Asmodae ! (France),youtube,국내,en
ايون 🔥❣,youtube,국내,fa
"Pay-to-Win kills longevity
Extra dungeon entries, gear boosts, and stat advantages drive players away. PvP-PvE dies if wallet size decides the winner.

Cosmetic-only monetization works
Skins, wings and mounts items are highly desired without breaking balance. Players spend more when it doesn’t hurt fairness.

Aion 1 had the best cosmetic system
Collecting flowers for dyes, re-skinning any armor, and true fashion freedom gave the game identity. If Aion 2 removes or paywalls this, it feels like a downgrade.

Community identity matters
Fashion, housing, and open-world gathering gave players reasons to stay beyond stats. P2W undermines that sense of individuality.

Trust & reputation
NCSoft already struggles with player trust. If Aion 2 repeats the same mistakes, veterans—the core audience—will leave and spread negativity.

PC vs Mobile controls
Aion 2 should be designed around PC-style controls (mouse + keyboard, full skill rotation, camera control), not simplified mobile-style inputs. The depth and precision of gameplay is a core part of the series.


👉 In short: P2W = short-lived hype, fast death. Freedom = loyal community, long life.",youtube,국내,en
Does anyone know if the PS5 is coming out?,youtube,국내,en
"Why not global launch? Its si boring to wait everytime a game is release. We see everything of the game before we can even touch it, so the hype fade.",youtube,국내,en
bro this looks a lot like throne and liberty and thats bad,youtube,국내,en
Aion one love! Origa's voice and this music in my heart! 😍,youtube,국내,en
"@Nanashiraz I don't even live in a country where English is the native language (and I recognize the privilege of knowing English and a bit of Spanish, which lets me enjoy almost 100% of the games that get released). I just wanted to be able to understand what's written on the website without having to use a translator that always messes everything up when trying to translate any Eastern ideogram 🥲. They should have made this global from the start. Aion has fans all over the world. It's not fair. 🥲🥲",youtube,국내,en
Uh no. Its 1.0 theme redone. Look up the 3.0 ost login. Its different,youtube,국내,en
they will make mistakes for the money 🤣,youtube,국내,en
AAAAAAAAAAAAAAAAAAAAAAAAAAAAAAAAAAAAAAAAAAAAAAAAAAAAAAAAAAAAAAAAAAAAAIIIIIIIIIIIIIIIIIIIIIIIIIIIIIOOOOOOOOOOOOOOOOOOOOOOOOOOONNNNNNNNNNNNN! NC DO NOT FAIL US! WE COUNT ON YOU !!!!!          LET THE MOST AMAZING GAMING JOURNEY BEGINNNNNNN!!!!!!,youtube,국내,en
guess we have to buy instant translate meta glasses 😂 ​@ronz_g6022,youtube,국내,en
It would be amazing if you release globally this year insted of only in korea,youtube,국내,en
global release 2025,youtube,국내,en
Global release 🥺❤🌎,youtube,국내,en
Global release?,youtube,국내,en
are we going to see the real gameplay? as all of these videos doesnt actually say anything in fact,youtube,국내,en
It looks like Throne and Liberty 2 . I think Aion 1 was more dynamic when it comes to combat skills wear wasted slower but looked prettier idk I've got mixed feelings with Aion 2 i don't want it to be like Throne and Liberty .,youtube,국내,en
Jesus I can’t wait 😳,youtube,국내,en
just WOAAAAAAAAAAAW !!!!!!!!!!!!!!! ça fait rêver ^^,youtube,국내,fr
"Aion was one of the greatest games until NC got greedy and ruined the game with cash BM P2W. Best PVP game still but no players want to spend thousands to enchant the gears to continue playing. Just GET RID of the P2W aspects of the game and Aion game will be great, even now.  I hope Aion 2 will keep the PVP game play, Keep the UI or similar to many skills it has in current Aion. NC can make so much profit from different skin BM. Weapon skins, armor skins, mounts, wings, etc. You have to have players for game to be fun. I hope Aion 2 does not make the same mistake.",youtube,국내,en
"Please launch it globally this year, not just in Korea. At least try it for once. You'd be truly surprised by the results and profits you'd achieve. For us players, it would be much better to discover it little by little and together than having seen other players' content beforehand 🙏🏻💖",youtube,국내,en
Спасибо за вашу работу! Ждем когда выйдет игра),youtube,국내,ru
Flying system just look terrific!!!,youtube,국내,en
❤GLOBAL PLEASE😢,youtube,국내,en
"wee need arabic in game
plzz",youtube,국내,en
Yes.,youtube,국내,en
English please ;(,youtube,국내,en
AION was a masterpiece. I hope AION 2 it's at the same level. I don't want a game named AION2 that it's not AION 2. AION WAS PERFECT.,youtube,국내,en
"Walk Animation fire, like Cross Arm Stance in Blade & Soul; Walk Feature nice Emotes too right? This works for me. Can’t wait to full dive into game. Legally looks stunning, though no arbitrary data breaching? Also customization is very detailed. How much did all this cost?",youtube,국내,en
"Let people farm drops whenever they want. This game will not last if you don’t do this. 

Don’t add the bad dungeon token system that you guys did in Throne and Liberty. You had to get tokens to get more tokens to farm rare drops.",youtube,국내,en
Please have Turkish language support,youtube,국내,en
Global release in 2025 please,youtube,국내,en
RELEASE DATE?,youtube,국내,en
GOTY CONFIRMED <3,youtube,국내,en
gameplay,youtube,국내,en
3:06  more please,youtube,국내,en
Please make the UI less mobile like and add more skill slots... ><,youtube,국내,en
"I hope there is a Housing System ⬆️, which allows you to customize and decorate your own Manor well.",youtube,국내,en
Global 2025 ❤,youtube,국내,en
"imagine making another shitty p2w game as throne and liberty, while you can watch really good mmo from 2014 = black desert online

idk without “ping glasses” this game looks so fcking bad, no joke, it doesn't matter what the customization looks like or how beautiful the world is when the core mechanics of combat and mobile interface are your main content that makes you want to puke",youtube,국내,en
another mobile game… keroen what’s wrong with you…,youtube,국내,en
"Да-да. Именно так)
Молимся на локализацию",youtube,국내,ru
No entendí nada jajaja😂,youtube,국내,sl
por favor que sea global y que sea de 1 solo pago como gw2... y estoy agradecido con el de arriba y si sale en steam... se los dejo como tunta a los desarrolladores.,youtube,국내,en
"Por eso toda mi vida fui clérigo, que clase hermosa",youtube,국내,pt
1 tank 10 dps 1 healer sounds better,youtube,국내,en
No,youtube,국내,en
Yo usare vpn y lo probare ❤,youtube,국내,en
No chance. Too early in development. It would surprise me if they manage to release in Korea in this year at all.,youtube,국내,en
"@yep8058 It has been confirmed that it will be released this year, and the global service will be released quickly, not much different from the Korean and Taiwanese release dates.",youtube,국내,en
TL 2 and tab targeting omg,youtube,국내,en
pls make english subtitles for your international community.,youtube,국내,en
You have a Western fan base...at least offer subtitling.,youtube,국내,en
If it Will be an international mmorpg why not translation?,youtube,국내,en
its 2025 bro put english subtitles in your videos 🤦🏻‍♂️,youtube,국내,en
"900k views in 3 days.
If this doesn't prove interest in AION 2 then I don't know what does.
Do not mess this up NC. Do not.",youtube,국내,en
Mobile? = P2W,youtube,국내,en
Let's go,youtube,국내,en
The hype is so real! :D - GG NCSOFT!,youtube,국내,en
"PLEASE do English Translation or Subtitels, i dont understand a single word! 😞",youtube,국내,en
Lets go Aion Team !!! You got it!,youtube,국내,en
😢global😅,youtube,국내,en
Çok merakla bekliyorum ❤❤❤❤❤❤,youtube,국내,tr
AION 2 BEST MMORPG EVER CONFIRMED?,youtube,국내,en
Please Make English SUBTITLE!!!,youtube,국내,en
"Dear korean community. Kindly asking you: if you can translate what producer saying about Aion 2 - please, translate it in English. Thank you <3",youtube,국내,en
We need  an official translation for this clip! 😂,youtube,국내,en
MORE AION 2 !!!,youtube,국내,en
"Make the dungeon system better. No tokens and should be able to run as much as you want. Even if the rate drop rate is lower. Don’t time gate the content. Was a huge mistake in Throne and Liberty. 

Make the open world drop system better too. Open world monsters should drop nice loot too.",youtube,국내,en
"Translation:


Hello, I’m Kim Nam-jun, PD for AION 2.
Since our first broadcast, so many of you have shared a wide variety of opinions and comments. Thanks to that, our development team feels an even greater sense of responsibility, and we’re fully focused on development right now.

Today, I wanted to take some time to read through those valuable comments you left after the first broadcast and respond to your voices together. (Wow, that came out a bit awkwardly, didn’t it?)

On the graphics
I’ve seen comments like, “Wow, those graphics are insane. I’m definitely going to have to try this.”
Reading those really makes me happy. I think our art team will be especially thrilled — they’ve been working extremely hard to make everything look beautiful.

We’ve had requests for both Eastern-style and Western-style characters, and even something right in between. Even though it was a tall order, the team worked hard and I think we’ve struck a good balance. Among current MMORPGs, we’re pushing hard to deliver the best graphics possible.

Someone said, “Well, at least the character’s pretty.”
Oh, so just the character? (laughs) Our backgrounds are beautiful too! Not just the characters — the whole world is being crafted with a lot of care. When you actually play, you’ll feel something very different and much better than what you get from just looking at screenshots.

On character designs
I’ve seen comments like, “Female character designs look pretty good.”
During our Focus Group Test, many players also said the male characters looked great. We’ve got a wide variety — some idol-like types, some rugged “man’s man” types. We didn’t know exactly what you’d want, so… we prepared everything.

On skies and environments
There was also a comment about how the surrounding sky and distant scenery were amazing. Since flying is such a big part of the game, we put a lot of effort into the skies and vistas. I’m glad that’s coming through, and I hope you’ll come see it for yourself.

On the gameplay trailer
I’ve seen concerns about the gameplay trailer. Honestly, we didn’t have time to produce a cinematic — we just captured footage directly from the game. Combat clips came from the combat team, background shots from the background team, and so on. What you saw is the real in-game graphics.

I personally think the game looks even better when you’re actually playing. I log in once or twice a day just to mess with the character customization, and every time I’m struck by how good it looks in-game — especially with lighting.

Next time, I plan to show character customization live, so you can see for yourself.

On the UI
Some people have said, “In the next YouTube Live, it would be nice to see actual development screens, including the in-game UI. We can’t trust it since so many mobile games hide this stuff.”
Alright — next live broadcast, we’ll show actual gameplay with the real UI on screen. Consider this the first reveal.

On unrevealed content
We still have so much content we haven’t shown yet. Before the official launch, we’ll keep revealing more through live streams, so I hope you’ll join us for those.

On nostalgic AION memories
One comment said, “I miss the old Rift battles. Traveling through space-time to mess around was so much fun.”
We know that excitement, and we’re making sure you can experience that again in AION 2.

Another person recalled, “The real legend was Dredgion. Over 100 people waiting at the Rift entrance, but only 30 could get in.”
Those kinds of memories and emotions mean a lot to me too, and I want to bring that feeling back. We’re doing our very best.

Reading all these comments directly in front of the camera feels different — it really hits home. I want to let you know we’re sincerely listening to your voices and preparing accordingly.

You’ll be able to see the true face of AION 2 through our live streams before launch, so please look forward to it.
And don’t forget to subscribe to the AION 2 channel and turn on notifications.

Thank you!",youtube,국내,en
yeaaay,youtube,국내,en
Будет ли Аион официально выходить в России???,youtube,국내,ru
One more bla bla bla video!,youtube,국내,en
"Pay to win, jonnah win",youtube,국내,en
Imagine using some subs considering you are gonna globally release this project,youtube,국내,en
aprenda español xD,youtube,국내,es
Шок. Зачем такое выкладывать.,youtube,국내,ru
I get goosebumps listening to the spells and music from the game. I really hope NCSoft gets it right with Aion 2  it's the game that left the biggest mark on my life.,youtube,국내,en
"No matter how bad this ends up being, I know my dumb ass will be there on day 1 because the music and nostalgia from this game has a chokehold on me. 😭😭",youtube,국내,en
The OG theme song... right in the feels 😭🎶,youtube,국내,en
"17 years ago i played aion for the first time, i feel like i am gonna do it again lol",youtube,국내,en
"The music hits hard, tear rolling down.",youtube,국내,en
"This look amazing, i'm glad Aion will be back",youtube,국내,en
NCSOFT PLEASE LEARN FROM YOUR MISTAKES WITH AION 1. DO NOT MONETIZE THIS TO HELL. I PROMISE WE WILL PLAY FOREVER IF YOU KEEP MONETIZATION FAIR!!!!!,youtube,국내,en
"That track in the beginning, brought back memories of may hours spent in the game, instant goosebumps.",youtube,국내,en
99% cinemac 1% gameplay,youtube,국내,en
"Oh man, this will be epic. Been waiting for so long to get Aion 2, hope the European Release will not be awfull, really wish I could get the true korean release here too, back in the days with very slow leveling and exploration of the world, finding all secred areas, invisible platforms you only can see when raining, and so on that was the best time. Not just level to endgame fast. Doing quests, knowing each enemy, each spawn of named mobs, grinding slow, leveling slow. Oh man that was the best time.",youtube,국내,en
Man it took them long enough. I've been waiting for years.,youtube,국내,en
"The game looks beautiful, hope to see more information about global release soon.",youtube,국내,en
"Как же хочется, чтобы NCSOFT смогла выпустить что-то адекватное. Хотелось бы верить...

В итоге,  как я понимаю, трансляция с презентацией уже прошла, и была удалена. Видимо стоит ожидать финальный факап и забвение некогда легендарной компании :)",youtube,국내,ru
"I don't understand korean language so i likely missed a lot of information, but this gameplay looks incredible.",youtube,국내,en
P2W not P2W I don't care... Good bye Throne and Liberty Hello AION 2,youtube,국내,en
"I've read something like it will launch in korea first then we git it later ..
I still dont understand why they always do this and dont make a global launch.. We will know everything about the game and the hype will drop with the waiting time...",youtube,국내,en
"i keep rewatching from start to the part that sorcerer (i think so, or maybe spirit master) casts a the spells. all the music and spell mantra are so nostalgic",youtube,국내,en
"These bosses in the end are gorgeous. Did Elden Ring devs help with that? 
Also, is that a chanter or a gladiator gameplay at 1:44?",youtube,국내,en
OH MY GOD! I waited for a whole decade for this sequel and its finally coming 🙌,youtube,국내,en
"I spent over 8 years on that game , it isn't just any game for me it's part of my life literally.",youtube,국내,en
but now we need a graphic card running by a fusion reactor 😵,youtube,국내,en
Love from Spain :),youtube,국내,en
Used to be Elyos Deyla EU haha... these memories. Rly exciting to try it! <3 Was my 1st big MMORPG and was one of the best!,youtube,국내,en
@MrDoctorProfessorPatch well NC is the only actual MMO developer we have in modern days. everyone else went full single player rpg and survival bs.,youtube,국내,en
"please, please, please, as a very old Aion player, pleaseeeeeeeee, don't ruin it with pay to win, don't ruin it as other mmorpg with gameplay too easy and simple... Pleaseeeeeeeeeeeee I love Aion, I miss Aion, I stopped few years ago because pay to win is a cancer. Please, just respect good old Aion skill and gameplay as 3.0 !!! We want good and fast character, incredible PvP and so nice PvE strat (as Tiamat dungeon) !!!!",youtube,국내,en
"This looks amazing, my best MMO games were always Lineage 2 and Aion so I hope this game will also come out on Xbox series X which I am currently playing on and I will be able to spend thousands of hours in this game with my friends :) ❤❤❤",youtube,국내,en
Не у тебя одного,youtube,국내,uk
i was like no way im touching this shit then they opened with tower of eternity theme and it was over for me i'm afraid. i lost.,youtube,국내,en
"Do not add daily chores and token limit for everything like tnl please, make it pc only 🙏🏻",youtube,국내,en
I've been missing Aion for so many years :'),youtube,국내,en
@farouche8670 ncsoft stated that there will be no auto mechanics and combat will be reactive with dodging etc.,youtube,국내,en
Great for making moovie! I will enjoy it!,youtube,국내,en
"@Ars_Illyrian Well fortunately for you, you didn't miss much so no worries :) Like seriously, they did say this is only the first of many live broadcasts to come and that the game is still in development, but even when all that is put into consideration they barely revealed anything. From the top of my head some noteworthy announcements included 
1. It's going to be playable both on PC and mobile, but they started development on PC and ported that to mobile not the otherway around
2. No auto combat and it will be non-targeted unlike Aion 1, more like how Tera used to be.
3. Flight will be possible in every map, everywhere.
4. Wings and mounts will not be lootboxes, mounts will be farmable from mobs
5. 8 classes from the original game will be available at launch (No idea what the English names for the classes are, never played Aion myself)
6. Game is set 200 years after the events of Aion 1",youtube,국내,en
"May the good lore and world building gods be with you with this one. But jokes aside, this is utterly gorgeous and nostalgia hit hard",youtube,국내,en
Ummm this looks amazing,youtube,국내,en
I'm so excited for a new entry in Aion universe <3 Please don't make us wait too much!,youtube,국내,en
"Ahhhh man... Aion was sooooo fun, the memories i have with it.. sigh.. 😢 i miss those days",youtube,국내,en
"Your not the only one, i am guilty as well haha",youtube,국내,en
