selftext,source,region,language
"If I hadn't seen ""Aion"" on the thumbnail I would not be able to differentiate it from any other korean mobile or pc game that has come out in the last 5+ years. What the hell happened? There was so much variety in the 00s. Lineage I/II, Ragnarok Online, Maplestory, Archlord, Mabinogi, DFO, Elsword. Now all their games look and play the same. Generic photorealistic UE5 fantasy world and plastic k-pop characters. Is this really what korean players want?",youtube,국내,en
"LET'S GOOOOO!!!! 
Game is looking great, can't wait to play it.",youtube,국내,en
"praying for Aion 2 to be better than the current Aion lmao, the trailer looks too good to be true",youtube,국내,en
@oceyho Don't forget insane p2w.,youtube,국내,en
"разработчики у nc хорошие, но потом приходит отдел продаж и вносит правки",youtube,국내,ru
Nostalgia like crazy.  Too bad they've already confirmed Heavy P2W for Aion 2 :(,youtube,국내,en
pfffffffff quel gachis .......... adieu AION un jeu mobile pour PC..........c'est lamentable,youtube,국내,en
@kRVRKV He was talking about the Aion2 live event that happened just before they posted this video.,youtube,국내,en
Legendary game.,youtube,국내,en
ок,youtube,국내,bg
"Те  времена  прошли  и  больше  не  вернуться.  Современный  игрок  по своей сути полный  казуал =  хочет  всё  сразу  и  как  можно  быстрее. 
Игра  будет  полным  провалом.",youtube,국내,ru
"@DrumBoom Yes, that's exactly what I feel too. It’s such a great feeling!",youtube,국내,en
"@MarkM_ Come on, let’s have some hope! :D",youtube,국내,en
"hermoso 😍😍😍😍😍❤❤❤❤❤❤ estuve en el live sin entender absolutamente nada, pero siempre presente, como te amo aion ❤❤❤",youtube,국내,en
Eu pude sentir o feeling da movimentação dos personagens... vai ser legal.,youtube,국내,pt
The nostalgia hits hard. 🥹,youtube,국내,en
Please bring Hyperion back 🥺and don't choose Gameforge as the European publisher 😬,youtube,국내,en
Aion was one of those MMORPGs I was truly in love with. I really hope they're putting everything into this version,youtube,국내,en
DAYYYYUMM!! ITS FINALLY HAPPENING BOOOOISS!!,youtube,국내,en
aaaah I spent so many years on Aion - Excited to get back into Chanter/Cleric!!,youtube,국내,en
Not me soaking 250 hours into Throne and Liberty within the first few weeks because NC made it 🤣,youtube,국내,en
Facts...,youtube,국내,en
"Don't make it such a grind, either.

Most ppl I played with quit b/c the grind or they got banned for botting as they attempted to alleviate the grind.",youtube,국내,en
"I truly believe that if its a $15-$30 a month ordeal with no pay to win, itll be better off than free to play pay to win.",youtube,국내,en
"With the direction they took the original AION and the mobile-PC development for AION 2, I'm skeptical. I wouldn't hold my breath.",youtube,국내,en
"أفضل تعليق.. شكرًا 
كلامك فيه ذكريات كثيرة بالنسبة لي",youtube,국내,ar
"классно, только просим вас не отдавать это под локализацию innova...",youtube,국내,ru
"I have some bad new for you xD, it's mobile too",youtube,국내,en
"Welcome back Aion!

Please make money only from skins",youtube,국내,en
"Not the way we knew it tho. Its action combat, with dodges, parries and other stuff like a souls like. No PvP like Aion basically was 90% of the day. But I am not gonna lie, the game has awoken some sick memories, especially seeing those bosses and dungeons that also looked absolutely insane.",youtube,국내,en
OMG WE'RE SO BACK.. Now lets see that PvP and Rifting Content,youtube,국내,en
"@Systemnick автобоя не будет, уже подтверждено",youtube,국내,ru
Used to be Elyos Spatalos 2009 how it sounds 😊 bringa me goosebumb hope in 2 years global release 😊,youtube,국내,en
Idk but we got spiritmaster im happy,youtube,국내,en
Probably Chanter i guess from her appearence and her weapon,youtube,국내,en
"@Maserjo 4 or 5th generation nvidia is enough, just turn on DLSS 3/4",youtube,국내,en
Se ve realmente increíble!!!,youtube,국내,es
RIP Chrono odsy,youtube,국내,en
bro they haven't said a word in the entire  video ,youtube,국내,en
"Can't believe I lived long enough to see AION 2. Fellow Asmodians, it's time to spread your wings again, fly through the dark places of the abyss together",youtube,국내,en
"The original soundtrack brings back soooo many memories. Loved Aion 1, can't wait for 2.",youtube,국내,en
I still have my original aluminum disc case for Aion.,youtube,국내,en
"That's ironic. Western MMORPGs recycle the same formula: medieval settings, basic Souls-like combat, and endless green landscapes.",youtube,국내,en
"I love how bad the perfomance is, it looks terrible and people don't realize they're probably using a workstation GPU that cost 8k dollars and it still runs like that lol what gpu do you got? You say that though and people will just say oh its alpha, beta, early access... yeah sure bud whatever helps you sleep at night. Besides that game looks awesome",youtube,국내,en
"Goosebumps! Amazing rework for the best game! Looking forward playing this if I will can, and guys introduce some little p2w elements, I know you will do it anyway, but just a little, else the game will fail again, focus more in cosmetics, with UE5, cosmetics are looking greater than ever.",youtube,국내,en
My heart started racing the moment I heard the music,youtube,국내,en
waiting for someone to reupload this video gamplay with 2 third of trhe screen covered with UI,youtube,국내,en
0:32 abyss is back?,youtube,국내,en
Same!,youtube,국내,en
"I know it won't happen but if they did a AUS server i'd literally cry.

Played on NA on Aion 1 release, still to this day the best pvp mmo ive ever played.",youtube,국내,en
"жду скорейшего выхода!!!!судя по ролику, графика на хорошем сбалансированном уровне.",youtube,국내,ru
La Corée n'est pas le centre du monde !,youtube,국내,fr
literally only gamplay xd wdym,youtube,국내,en
"Графика, огонь! И слышны слова произносимые персонажами из первого айона во время каста заклинаний. Дай Бог, чтоб не испортили боёвку ради кросплатформы. И не отдали игру жадным локализаторам. Любые ММО губят жадность локализатора, и невменяемые патчи под диктовку маркетологов, которые не одну гениальную игру угробили, потому, что разработчики и игроки ближе друг другу по духу чем любой бизнесмен.",youtube,국내,ru
Just amazing !,youtube,국내,en
"@mrdata9823 ya sadly, looks like it's gonna fail already",youtube,국내,en
in my opinion the second greatest mmo in the world after wow,youtube,국내,en
"Does it? It looks half baked in performance, since even in the trailer the game runs rough on some points.",youtube,국내,en
"@oceyho it looks like BnS combat, boss mechanic gonna be insane",youtube,국내,en
"I wonder is there still any conflict between asmo and elyos, hard to say during the trailer, but looks amazing, wanna play it so much",youtube,국내,en
​@macalan4443 Haha I remember Spatalos being Elyos central!,youtube,국내,en
Yes please! But not gameforge please !,youtube,국내,en
"Ca donne envie, la commu FR est hype c'est sur ! Merci NcSoft !",youtube,국내,en
THE MUSIC THE MEMORIES,youtube,국내,en
"This trailer gives me somewhat gw2 vanilla time vibes, dunno why.",youtube,국내,en
be ready to wait 3-5 years for global release,youtube,국내,en
"very very nice, good work guys!",youtube,국내,en
HYPE !!!!!!!!! 👇,youtube,국내,en
"Make it subscription again as you did with Aion 1 when you released it. The game went downhill and became worse and worse the moment you switched to f2p with ingame shops.

Give us the old veteran system, make the subscription 15,90 Euro/month.

Ingameshop for cosmetics only. Means no candies and no shit other than skins.

Most importantly... leave out these shitty minigames. Nobody wants these annoying flashy and sorry for bad lang. SHITTY minigames. We want good FLUID fights. We want dungeons like Dark Poeta with ranking systems for different endbosses.

We want free PvP, open world PvP, Rifts.

We dont want ugly and disgusting korean skins, no unlogical classes like gunner, mech or painter
Like really, whose birdbrain had these ideas???

Don't give gameforge licenzing because Gameforge is the worst publisher on earth.

Just my 2 cents.

I can tell you, if you make f2p and go down the ingame shop p2w meta you aint selling shit, you can go bankrupt for all i care.
 we will stay on private servers and play Aion 1",youtube,국내,en
P2P + Global Release,youtube,국내,en
"Aion, my first love and ignited my love for high fantasy in everything. Please please ncsoft, dont mess this up. If this comes out in NA, i will be there day 1",youtube,국내,en
music brings youth memories we all share here 😢,youtube,국내,en
"NCsoft hope u make game tarjet tab same original aion, and please make with subscription no battle pas and more important in europe don't let gameforce take this, and please don't be silly and make global release, u dont learn about your others games?",youtube,국내,en
this brings back memories!! cant wait to play!,youtube,국내,en
I am very hyped and  scared at the same time that this is gonna be a auto-everything mobile game.,youtube,국내,en
"Boring...pay2win waste of precious time that you cannot buy or get back anyway !! 
Wake up from illusions !",youtube,국내,en
"Please, let Asmodians keep their mane, and give them back the option to have their clawed hands and feet! I've always loved that, and it was such a shame to have had them removed!",youtube,국내,en
"Please please please don't ruin this Game with pay2win like you did on the first Version. I played it for years but then stopped because pay2win got so out of hand, that even players with lots of time could not keep up.",youtube,국내,en
We’re so back ! I want to play chanter again,youtube,국내,en
is this pay to win like they made AION? cuz honestly thats what ruined the game for me.,youtube,국내,en
"The first soundtrack. Ahhh man, instant goosebumps. I really miss this game, my childhood was completed with this game. I was introduced to online games at the age of 10, and the first online I ever played that got me sooo addicted was Aion. I enjoyed the game so much that I pulled an all-nighter most of the time.",youtube,국내,en
"The UI will be important for critic, make sure it looks good",youtube,국내,en
Absolutely breathtaking...thanks for dedicating so much effort into this. I CAN'T WAIT TO PLAY IT!!!!!!!!!!!!!!!!!!!!!,youtube,국내,en
So glad I bought a 5090 last month. 😂,youtube,국내,en
Ik its gonna be pve focused but i think after they see how much people like pvp more(more ppl will stay for pvp cause when u get full gear in pve there is no need to play) so i hope they make like a big pvp update. I still hope we get some type (like arena) pvp. Open world pvp is where aion shined. They shouldve made the game pvp focused. It wouldve been an even bigger succes,youtube,국내,en
Hmmm I'm listening,youtube,국내,en
"Please, DO NOT make a MOBILE version. It always worsens the quality of the game and makes the gameplay primitive.",youtube,국내,en
"Exactly my thought, just don't be greedy and the money will come",youtube,국내,en
Please don't follow the DI path. Can't wait to see the in game footage!,youtube,국내,en
"Chrono Odyssey, Aion 2, what's next, TERA 2 ?",youtube,국내,en
Archeage 2,youtube,국내,en
"@yoshi3706 Ah right, forgot about that one.",youtube,국내,en
"Hope it is how it seems, it looks good, combat is great. Might be hyped actually ❤",youtube,국내,en
"It’s - either a scam, or arguably the most beautiful game in existence of humanity.
I hope it’s the latter.",youtube,국내,en
"LIKE I SAID ON THE PREVIOUS TRAILER, NCSOFT PLEASE HAVE BALLS, PUBLISH IT YOURSELF IN OTHER REGIONS DONT SEEK PUBLISHERS, DO IT LIKE RIOT GAMES!!!!",youtube,국내,en
We are going home,youtube,국내,en
Ojalá lo traiga Amazon games y no gameforge,youtube,국내,es
"2:23 i dont know bro i dont know, for me it looks like throne n liberty or even worse.... plz noooo",youtube,국내,en
1000% play 👍🏻,youtube,국내,en
Incoming heals! Hachabenpa!,youtube,국내,en
"This brings back a lot of nostalgia, please don't mess it up with p2w...",youtube,국내,en
"Throne and p2wer + aion skin, nice scam.",youtube,국내,en
What has NCSoft ever gotten right? They ruin even their good games.,youtube,국내,en
"Are you going to buy EVERY single skin? NO. it is not enough to support the game!
Get real.",youtube,국내,en
If it indeed has horizontal progression games DOA.,youtube,국내,en
"Мобильная ммо на анриале с эльфийками и автобоем будет. Ничего адекватного они не выпустят, потому-что будут делать что проще и что приносит деньги.",youtube,국내,ru
"BRAZILIANS ARE WAITING EASILY FOR THE LAUNCH. OUR AION COMMUNITY IS HUGE. PLEASE DON'T RUIN THE GAME BY INVESTING IN MONTHLY FEES LIKE THE DAEVA PASS, THIS RUINS THE GAME. TRY TO USE ONLY THE BATTLE PASS AND COSMETICS, THIS WILL ALREADY GIVE YOU A LOT OF PROFIT. DAEVA PASS SCARES PLAYERS AWAY. LESS IS MORE.

OS BRASILEIROS AGUARDAO ANCIOSAMENTE PARA O LANÇAMENTO. NOSSA COMUNIDADE AION EH GIGANTE. POR FAVOR NÃO ESTRAGUE O JOGO COLOCANDO MENSALIDADES COMO O DAEVA PASS, ISSO ESTRAGA O JOGO.  TENTE USAR SOMENTE PASSE DE BATALHA E COSMETICOS, ISSO JA DARA MUITO LUCRO. DAEVA PASS ESPANTA OS JOGADORES. MENOS É MAIS.",youtube,국내,pt
"This is exactly what I've been waiting for♥

I can already see myself getting lost in this world for months and maybe even years. Watching this trailer instantly brought back memories of playing the original. It was such a beautiful experience. I think the second one is even better. The visuals are absolutely stunning indeed.",youtube,국내,en
You will wait another few years. Its just a trailer 😂,youtube,국내,en
"It really looks like Throne and Liberty but with Aion flavours (In a good way in terms of graphics), but I hope that the game is not gonna be a copy paste of TnL system and also they wont kill the dynamism/Aggresiv gameplay of the original version...",youtube,국내,en
"Elden Ring MMORPG copy, Elden Ring boss copies, Aion is dead, next...",youtube,국내,en
@Fishingsloth на это они и расчитывали,youtube,국내,ru
only pc game not mobile.  Mobile game = rip game  create pls legendary game like WOW,youtube,국내,en
​@ErisV2how many years it past just...,youtube,국내,en
"Cuando un juego de PC estara en móvil y este seguramente tendra cuatro miseras habilidades para usar, para colmo la mecanica se ve horrible, para nada es libre como en Aion original, animaciones muy largas y inmóviles en las que no puedes moverte libremente o con movilidad mas lenta que un caracol seco, que divertido tiene quitarle todas las mecanicas y jugabilidad a un juego? Entonces que lo hace divertido? La calidad grafica? Que se para movil? No, eso es fugaz y pasajero, lo que realmente engancha gente a los videojuegos no es que sean bonitos, es que sean divertidos mecanicamente aunque la calidad grafica sea nefasta. UN MARIO KART EN AION? ESTAMOS TONTOS? Quien quiere arruinar un juego con estetica de fantasia con un juego de mario kart, en fin este juego no tiene futuro, solo es PVE para el PVP por falta mecanicas y habilidades estas no tendran ningun sentido, ganara el que mejor conexion tenga o el que mejor equipo adquiera, totalmente un P2W. Aion classic fue la esperanza de muchos, y lo estan haciendo muy bien, por que simplemente remasterizar el juego y hacerlo con estos graficos y nuevos mapas? Enserio deben crear otro juego como en la 6.0? Para que? Perder dinero... Perder audiencia...? Es exactamente lo mismo pero con mejores graficos, Habéis vuelto a ilusionar y estafar a la gente, otra vez rompiendo la esencia de Aion, pero manteniendo un poco la estetica como hicieron en la 6.0, Muchas gracias por no escuchar a vuestro publico cuando ellos son los que os mantienen con vida y hacen fluir vuestro dinero. Saludos, Cuídense.",youtube,국내,es
давайте просто изменим направление на ПК.,youtube,국내,bg
"Wouldn’t make sense to bring Hyperion back from a lore perspective, so I doubt it 😬",youtube,국내,en
please don't let it be published by a stupid or greedy publisher in the west x),youtube,국내,en
Its a pc game... was mentioned in thenlive stream.,youtube,국내,en
2 😉​@bexplosion,youtube,국내,en
Supposedly Q2 of 2026. Next month closed beta will start.,youtube,국내,en
Absoluto cine,youtube,국내,en
Looking forward to playing it. Can't wait,youtube,국내,en
"Sunk cost fallacy is the phenomenon whereby a person is reluctant to abandon a strategy or course of action because they have invested heavily in it, even when it is clear that abandonment would be more beneficial",youtube,국내,en
This looks like its going to run like complete crap on even the best machines.,youtube,국내,en
Pro Brasil vai ter,youtube,국내,en
NC Class ...,youtube,국내,en
I need a Lineage 3 looking like this god...,youtube,국내,en
That track at the beginning! 🥹,youtube,국내,en
Вспоминаю сколько лет было потрачено.. Плачу..,youtube,국내,ru
ojala si existe una ciudad pandemonium tenga esa musica de fondo para tener algo que te haga sentir en casa,youtube,국내,en
"I was excited for a moment but then I realized this won't have tab target combat.. :(
Then it's a pass for me.",youtube,국내,en
"nice game,by the time RTX 15090 comes out,early 2045 it will be avaliable :D",youtube,국내,en
滿滿的期待 換來的是滿滿的失望..RF Online Next我來了,youtube,국내,en
could be the best final fantasy ever released,youtube,국내,en
No mass pvp and no tab targeting with real skill involved due to multiple skills? fail!,youtube,국내,en
QUE NOSTALGIA Y ANSIEDAD QUE SALGA YA!!!! gremio latino insta cuando salga,youtube,국내,en
"need money for a pc to play this magestious game
",youtube,국내,en
YES YES YES YES,youtube,국내,en
so nostalgic! im excited :3,youtube,국내,en
nice,youtube,국내,en
I can't wait!! I'm so excited!! Bring back the original aethertapping!!  🤩🤩,youtube,국내,en
I  hope they bring back the 1.0 soundtrack in this game,youtube,국내,en
PLEASE INRO JOO AT THE OST,youtube,국내,en
"Please don't destroy the most important thing about Aion by putting Elyo and Asmos on separate servers. Please don't ruin it

por favor no arruinen lo mas importante de aion , separando los asmos y elyo por servidores separados que eso es lo mas importante del juego",youtube,국내,en
What about the old problem — cheats no animations or “gliding”? Is the game protected in any way against such cheats?,youtube,국내,en
"lemme guess after few months of release the game is dead just like any other mmo
We would like to see some permanent damage effects on the BOSS, like arm gone or cuts in the body.",youtube,국내,en
I remember the first days of aion 1 ❤ And now i have the hope that aion2 gives me the same felling 🙏🏼🙏🏼🙏🏼,youtube,국내,en
Avete fatto fallire aion mandando via tantissimi giocatori,youtube,국내,en
please bring back song weaver LOL,youtube,국내,en
The pay2win is going to be insanely crazy im sure. Please enjoy it while you can guys when it finally comes.,youtube,국내,en
To think its been 17 years already...,youtube,국내,en
Okay see me in PVP.,youtube,국내,en
"You have a beautiful world. I hope you learn from past mistakes, or you'll continue to waste it. I hope you ask yourself these questions: What did we do that left no players? Instead of forcing every language to be downloaded, languages can be downloaded later. You've probably seen how other games make money with artistic cosmetic content after the game is ready. AI can be used for languages with few users; it's better than nothing. Instead of deleting beautiful maps, you can distribute people on old maps with events. You already have beautiful art design. For example, someone who enters game just to look at them might see a higher level player and want to stay. There are many more things like this, and you should consider them. I hope everything goes well. I wish you success.",youtube,국내,en
Ждем выход игры в России 😍😍😍😍😍,youtube,국내,ru
"holy moly if it even looks half as good as this, I'm done. IT LOOKS SOOO GOOD. And it looks like a different story which I'm fine with. I hope they keep some of the gear though, I really like the endgame gear",youtube,국내,en
se ve hermoso.,youtube,국내,en
I wish MMORPGS weren't ruined by P2W.,youtube,국내,en
"Playing Aion in 2009 was the best thing ever! The PvP was insane back then. I hope Aion 2 will have the same systems and adds more amazing features! I can't wait to play Aion 2 ❤‍🔥
NO P2W . . .",youtube,국내,en
ENGLISH POSTERS UPVOTE THIS. NO P2W!,youtube,국내,en
"Please don’t ruin Aion’s name with Aion 2. Do a good job, and don’t change Aion’s original combat. I hope you’re truly making an Aion game — not just using its name.",youtube,국내,en
Please be good please be good please be good please be good please be good,youtube,국내,en
"It's a shame that Aion's legacy won't be continued as a PvP game — instead, they'll be focusing on PvE.",youtube,국내,en
I've been waiting for you for 10 years,youtube,국내,en
"We are really looking forward to it. You killed the current Aion and Aion Classic. We hope that Aion 2 will be worthy. We need a good base to start with. Mechanics and calculations of character movement, battles, combat. Collection, crafting, dungeons. We really need interesting dungeons. Mechanics that will unite players, and not quarrel them. We want a classic tank-dd-healer system. In the current Aion, a tank is not needed in a dungeon, and healers go to dd.",youtube,국내,en
"At first glance, this does not look like the original Aion style.",youtube,국내,en
"FIND A GOOD WAY OF MONITIZATION, PLEASE NO CASHGRAB. I WILL GIVE YOU MY MONEY, BUT NOT FOR ENHANCEMENT MATERIAL AND BOOSTERS, BUT INSTEAD FOR SOMETHING ELSE, LIKE COSMETICS, AND WHY NOT PAY TO PLAY INSTED OF  PAY TO WIN THATS ANOTHER PATH AS WELL. YOU CAN BE MORE CREATIVE GUYS, I WANT THIS TO BE THE BEST MMORPG IN FUTURE HISTORY! NC TEAM YOU CAN DO IT THIS TIME PLEASEEEEE! <3",youtube,국내,en
Nc soft !!!!! Please don’t mess it up again ! Please please please 🙏,youtube,국내,en
Copium level max,youtube,국내,en
I can't wait!!!! I played Aion from 2012 to 2019!,youtube,국내,en
this combat from aion 1 cant survive in modern mmo era so they need change it!,youtube,국내,en
please dont mess this up guys…,youtube,국내,en
The graphic looks so good. I can't imagine that I could play with those dense graphic qualities on my phone. I can't wait!,youtube,국내,en
"RU комьюнити очень ждет тот самый ламповый Айончик из 2009г., такой чтобы прямо снова на года, просто с обновленной крутой графикой, не мобильный, без автобоя и дисбалансного доната. Можно таргет, можно нон таргет.. Можно по подписке, можно разовой покупкой. Всё равно будем ждать, только пожалуйста не повторяйте ошибок TL и не делайте из Aion 2 ещё одну L2M. Вам всего хорошего, здоровья, удачи, ждем новостей и стримчанский конечно же.))",youtube,국내,ru
Worst developer ever. We'll watch and enjoy how it fails.,youtube,국내,en
"They can change the combat for good.
I hope the devs really make it a PC first game. Not a mobile port to PC. This IP has incredible potential.",youtube,국내,en
"no p2w... in korean mmorpg... bro, ur copium is 2 much",youtube,국내,en
This music give me shill 😻😻😻,youtube,국내,en
AION2 IS REAL!!🗣🗣🗣,youtube,국내,en
Forget your phone,youtube,국내,en
Now you have a great chance to make things right...I hope you won't mess it up this time. Cheers!,youtube,국내,en
"Надеюсь, это будет действительно aion, как в былые времена, который приносил невероятное удовольствие,  а не вот эта мобильная пакость, которые проваливаются одна за другой, вообще смысла не вижу делать мморпг старой школы на телефонах",youtube,국내,ru
"Мы как РУ комьюнити Айона будем ждать стрим 29 числа на нашем канале. Так же уже своё мнение выложили в виде видео =)
АЙОН 😍",youtube,국내,ru
Absolutely. They're going to p2w again.,youtube,국내,en
"Yo solo quiero volver a ser feliz en Katalam y Tiamaranta, no pido mucho :v",youtube,국내,en
