selftext,source,region,language
"They already said the game will have pw2, Kanon interviewed them. 2nd the game will probably be a mix bewtween mobile elements and PC/console. So in conclusion, it will not be at all like our beloved OG Aion back in the day.",youtube,국내,en
make it just for PC and we fine. make it for consoles and mobiles and get another fail game like TL,youtube,국내,en
"ok , but can it only be played in korea in 2025? is there any other way for me to play it, being from Romania? I'm interested in the Android version to play it now from 2025 in Romania. What do I have to do? (for example, enter the servers in korea or put it in korean or what. I'll do anything! I accept any option!",youtube,국내,en
"P2W & mobile? If it's true, it's a hard pass from me. Typical Korean games. 🙄",youtube,국내,en
ils ne savent pas écoutez ce que leur demande les anciens jouer d'Aion,youtube,국내,fr
"This is your only chance, please don't miss it.",youtube,국내,en
Nah ... NC has been done .... for long time already.,youtube,국내,en
Please! We need a global server or NA! PLEASE I beg to you🙏🏻,youtube,국내,en
"I hope they keep classes as they were in aion 1.0,i dont like this fluid class shit",youtube,국내,en
Only skin inshop please. No random no predatory p2w if you want to suceed,youtube,국내,en
Aion's BGM is what made it my favorite MMORPG of all time. It's just magnificent. I really hope they do a great job with Aion 2 😢,youtube,국내,en
😮globalizaçao global❤,youtube,국내,hr
is it pc only or mobile support?,youtube,국내,en
"you dont know exactly,if I remember right,they said there wont be factions anymore,but here we are.",youtube,국내,en
"@paultornean8453 
I hope that after the success of Aion Classic in Korea and the failure of Throne and Liberty, they went back to the drawing board and changed some of the concepts, and that's why there has been no new information for the past six years.",youtube,국내,en
"I really don't care at all, but at least they need to balance pvp and pve. Example: aion without open pvp areas is not aion... The old and good pvpve. They need to keep this.",youtube,국내,en
Tbh i couldn't be happier. I only had bad experiences in aions pvp. The world and lore (and the flight of course) were what made me fall in love with it <3,youtube,국내,en
"I was an Archer in Aion and I met an Assassin name Becca. She didn't play any game other then Aion and I fell in love with her. She had been burnt and survived a fire irl growing up where she lost her twin sister. She has burn marks all over her body and face, but I thought she was so beautiful all the same. But the loss was to great and she died from an Overdose doing drugs 2 years after I met her. I miss her very much and I love her to this day. I will be playing Aion 2 in honor of her memory, the game we both loved and the game where we met. I miss you very much Becca. Rest in peace my love.",youtube,국내,en
"So aqui ja temos 464 mil pessoas que estao esperando esse jogo , nao nos desaponte NC , nao importo de pagar 100 dolares no jogo , mas o jogo deve ser igual para todos!",youtube,국내,en
Go global release ⚡💯,youtube,국내,en
Pay 2 Win Game,youtube,국내,en
please keep tab targeting!,youtube,국내,en
Is this going to be a flop? I'm kinda excited about this.,youtube,국내,en
Ncsoft please make Lineage 3 old school monthly subscription no micro transactions,youtube,국내,en
Hopefully Gameforge won't be the publisher for the European region,youtube,국내,en
"You took your sweet sweet time to finally give us that ""Aion Vision"" you promise 15 years ago ❤",youtube,국내,en
I love the amount of 0% trust in NC Koreans have in the comments.,youtube,국내,en
"I have so many fond memories of playing melee and flying towards a ranged class in the OG abyss getting ""target is too far"" messages while right on top of them and raging. 😂 Good times.",youtube,국내,en
No p2w or we dont come,youtube,국내,en
Omg looks so good???!!!!❤❤❤,youtube,국내,en
OMG ! This is Real. My favorite MMORPG  ❤❤❤  Lo estoy esperando con muchas ganas!  ❤ South America  server PLS ! ❤,youtube,국내,en
please no mobile UI.  We need true pc game!,youtube,국내,en
"En cuánto salga este juego, lo jugaré desde el momento en que este disponible!!!
Me a dado directamente en el fondo de la nostalgia, que recuerdos!!! >.<",youtube,국내,es
Read comment ! All region of world are waiting for this game !!! Dont miss your chance !,youtube,국내,en
"Aion (4.5 version) was my favorite mmorpg ever, please ncshit dont ruin it deleting maps and ruining the campaign by deleting things like you did with 4.8 and 6.2 update 🤢",youtube,국내,en
Bro it's been 15 years. It can't stay the same graphically. But It can stay almost same on gameplay aspect,youtube,국내,en
i really hope its not mobile port to PC :/,youtube,국내,en
"yo igual, por ahora no me quedo mas que jugar en euroaion, para poder jugar en esos mapas",youtube,국내,en
ХОТЬ бЫ нЕ МОЛЬНЫЙ ШЛАКК!,youtube,국내,bg
No auto play NC Soft. Make the game more like a PC level experience in mobile,youtube,국내,en
лучшая игра была вов,youtube,국내,ru
Yesssssssss🎉🎉,youtube,국내,en
"Дорогие НСсофт. Русскоязычные поклонники Ваших ММОРПГ с некоторых пор (последние лет 8) называют вашу компанию ""Компанией, которая когда-то действительно умела делать игры"". Увлёкшись примитивными, майнстримами, отдав свои проекты на откуп эффективным менеджерам, вы забыли что такое делать игры. Всё что вы делали последние годы - это пытались реплицировать/реанимировать Линейдж 2 и её успех, во всех позах камасутры (простите) производя тонны мобильного шлака, пардонтес, извиняюсь, не так выражаюсь - ""кроссплатформенных игр"" (так правильно?) что ваши преданные фанаты уже давно перестали в Вас верить. Что закономерно сказывается на Ваших доходах. И я вам сейчас Америку открою наверное, но увеличение монетизационной нагрузки не сделает ""средний чек"" больше, а ваши доходы выше.
Лично я уже ни на что не надеюсь, но хотя бы не трогайте своими грязными руками мою любимую игру - Айон. Не превращайте и её в говномобилку где донат в донате, а в донате рандом, а сверху гача в гаче, верхом на гаче.  Красивая картинка и музыка, вызывающая отклик в сердцах игроков - совершенно грязный ход. Особенно после того, что сделали  Nrtmarble c RF Online. Позор. Не хочу такой судьбы Айону.  Остановитесь. Не забивайте в крышку своего гроба ещё один гвоздь. Или TL вам было не достаточно?",youtube,국내,ru
and please no panda candies and car mounts,youtube,국내,en
They literally showed nothing and what looks good? 🤣🤣,youtube,국내,en
"toutes ces musiques me rappel tellement de bon souvenir, jusqu'à ce qu'ils décident de retiré des cartes et détruise le jeu de plus en plus, quand on pense que sur l'officiel ils ont meme enlever les Abysses 😢",youtube,국내,fr
it ll be p2w,youtube,국내,en
Please focus on PvP 😢,youtube,국내,en
"For all I know, Both would be supported like the Kenshin Impact or ZZZ",youtube,국내,en
"It's NCsoft, they are litearlly unable to not make a p2w game after 2015",youtube,국내,en
"Why I love Aion2 ?. It's because of there's my favorite class: Spirit Master (The Summoner). He could summon 4 types (Fire, Water, Earth and Wind) of ""powerful damage summons"" beasts to help us in combat. At the same time we could attack using different elemental castings. I'm a wide mobile player and thank you love Aion 2. ❤️🙏",youtube,국내,en
"Its funny to read all these negative comments, while Aion is one of the most played games in KR, top 10 i guess... funny guys.",youtube,국내,en
cant wait,youtube,국내,en
türkçe yayınlayın la,youtube,국내,tr
The World want a new Aion like the 1 before Balaurea release ! the war between Elyos and Asmo with more balance !,youtube,국내,en
Mobile or just pc ?,youtube,국내,en
"They must bring old school vibe in to mmos genre hard core grind, hard to lvelup clases, races, profesions open world pvp with gw2 goat combat and more now you have like max lvl in day 1 almost no pvp same daylis and cop dungeons over and over again",youtube,국내,en
Make Aion great again 💯,youtube,국내,en
come on start the stream cuh,youtube,국내,en
"Hola ya queda menos, jugare con ping alto pero me preparare cuando llegue aca a america, serq genial volver a jugar aion",youtube,국내,en
Throne and Liberty 2,youtube,국내,en
It better not be like other games that have a mobile version where it wants to auto do everything for you...I hate that and quit right away when games do that.  I played Aion from 2009 to 2016 and I just hope this is good for as long as we have waited for this.,youtube,국내,en
Please NC! PLEASE! 🤩,youtube,국내,en
"I hope we get to twink pvp like the good old days. No matter what you guys say at the comment section, i havent been excited for a game release since i was 15",youtube,국내,en
i am crying mofo!!!!!!!!!!!!!!!!! i am crying!!!!!!!!! this is soooooooo beautiful and emotional!,youtube,국내,en
no not MOVE ON.,youtube,국내,en
Hope nc learn not to kill this 1  with p2w,youtube,국내,en
no te entendi ni verga no se ingles,youtube,국내,en
"Вау, неожиданно приятная новость😊😊",youtube,국내,ru
This game will last 3 months then it will die,youtube,국내,en
"I hope it's not like throne and liberty. I haven't played aion, so I don't know what's that like. But I really hope this turns out to be good and I would like it. Hope it has better controller support too, coz I can't play games without a controller.",youtube,국내,en
Need News Lineage 3 and Guild Wars 3 Come On  NC SOFT,youtube,국내,en
The biggest upgrade: Daevas can swim!,youtube,국내,en
"esperon qu'ils ne nous fassent pas un aion pourri comme ils ont fait avec le aion classic, qui au final n'est pas du tout un aion classic. Et qu'ils ne fassent pas non plus un aion comme l'officiel que l'on connais aujourd'hui! prenez exemple sur certain serveur privé qui eux on su garder le jeu plus pres du aion qu'on a connu. Vous n'avez qu'a prendre exemple sur EuroAion un , et peut etre meme le meilleur serveur privé",youtube,국내,fr
"I'm a french guy who managed to play first Aion KR beta and then spent years enjoying the game when it came in europe. I tried Aion Classic at launch but all  I could see was not a gift to the fans but a ""melancoly cash graber"", so ... NC... I think the future of Aion is in your hands, if you treat your playerbase with respect, you win... otherwise, you'll just get money at launch and then your game will quickly die. (p.s : and stop with your stupid ""big heads"" skins & all of that, it makes your game universe look like a circus..just give people some badass looking' gear ;) )",youtube,국내,en
Dude if this is even 1/2 as good as Aion 1.0 was I WILL THROW MONEY AT THIS FRICKIN THING,youtube,국내,en
Ncsoft 😂😂😂 no thanks 😂😂😂,youtube,국내,en
gameplay please,youtube,국내,en
HYYYYYYYYYYYYYYYYYYYYYYPEEEE!!!!!!!!!!!!!!!!!!!!!,youtube,국내,en
"I played Aion 1 back in the day since the beta and I loved it, to this day it remains one of my favorite games with many dear memories. The classic Aion 1, that is, when we still had the monthly subscription model and when game quality was still the main focus for the developers. Considering what an atrocious shallow cash grab game NCSoft and Gameforge made out of Aion 1 over time, starting once they made it free-to-play, I'll be very cautious with Aion 2.",youtube,국내,en
This is old Aion music is amazing!,youtube,국내,en
"I love Aion, my lovely mmorpg, but pay to win is badly.",youtube,국내,en
"PC MMORPG please, please no mobile, dont ruin our memories",youtube,국내,en
EU version?,youtube,국내,en
Lostark never die,youtube,국내,en
OK  TT,youtube,국내,en
@SHYWo_o ㅋㅋㅋㅋㅋㅋㅋㅋㅋㅋㅋ,youtube,국내,pt
globalização GLOBAL ,youtube,국내,pt
Young Shandi ❤,youtube,국내,en
onstove is zzzzzzzzzzzzzzzzzzzzzzzzzzzzzz,youtube,국내,en
Rip loa pc,youtube,국내,en
1 billion % i'm so playing this,youtube,국내,en
Global Launch now!!!!!,youtube,국내,en
"this is underwhelming, was expecting mobile to be somewhat new not recycle stuff from PC.",youtube,국내,en
WOW,youtube,국내,en
Now I can auto my Guardian Raids.,youtube,국내,en
Will there ever be global release for this game? Gamers across the regions are waiting,youtube,국내,en
Ayaya with katana... LET'S GOOO !!!,youtube,국내,en
ONLY IN KOREA?,youtube,국내,en
finally a mobile game that will respect my time........,youtube,국내,en
too many weirdos playing this game that this appeals to unfortunately. been hoping for male assassin or samurai class forever,youtube,국내,en
Please don't add auto play or auto combat,youtube,국내,en
Yes global open,youtube,국내,en
For the love of god please make a samurai class that is not a specialist,youtube,국내,en
This some sort of an early April Fools?...,youtube,국내,en
When the devs heard that there was a Samurai class needed using Martial Artist’s model they probably just heard the “Artist” part and accidentally slapped it on her instead 😂,youtube,국내,en
AYAYA BLADER? GOOD LORD,youtube,국내,en
Just don't make it the auto playing sh*t they make nowadays,youtube,국내,en
I wish i can read korean. I only know oppa gangnam style. Heyyyy sexy leydeeehh,youtube,국내,en
Exciting! When is Open Beta,youtube,국내,en
Yeah,youtube,국내,en
Is this some out of season April fools joke?,youtube,국내,en
The English comment your looking for.,youtube,국내,en
2026 global release? 🤧🤧🤧🤧,youtube,국내,en
I actualy like the idea of little Ayaya Samurai class. In contrast to her samll size the blade will look huge. I just hope we will get it on PC ver. too. I dont have the best phone to play it mobile :(,youtube,국내,en
Not a fkn specialist with dual blades.,youtube,국내,en
they'll never realease a samurai class because of the past history,youtube,국내,en
"The game looks awesome, but at the same time it feels boring. They never focus on PvP or guild wars to create real hype within the player community.",youtube,국내,en
🤢🤮💩🤡flop,youtube,국내,en
game dead?,youtube,국내,en
Lost ark SEA when ?,youtube,국내,en
please global & SEA too,youtube,국내,en
OMG when it comes ?,youtube,국내,en
I can't wait 😍😍,youtube,국내,en
Dont make it too long. There will be another game good than u,youtube,국내,en
I will play this because there is a Katana wielder. Wonder when it comes out .,youtube,국내,en
Let's invite pets and companions 🥹🥹,youtube,국내,en
Ждём!! Надеюсь будет интересно!!,youtube,국내,ru
Global!,youtube,국내,en
Do the English version alongside and make this globul,youtube,국내,en
Que venha pra gente,youtube,국내,en
Loli with Katana wtf,youtube,국내,en
AYAYARAI,youtube,국내,en
Samurayaya,youtube,국내,en
watdahelll,youtube,국내,en
the mobile will explosed at the first quest maybe in queue,youtube,국내,en
SBSS,youtube,국내,en
"Fucking cash grab, as if you weren't already squeezing the money out of everyone's wallet to begin with. Do you think this profit will funnel to the main game? No, like every other fucking mmo phone game it's just to make you cash cows and divert development time away from the main game.",youtube,국내,en
new main apenas,youtube,국내,en
this is what a 7/8  -1 support lobby looks like,youtube,국내,en
"Garbage mobile port has a hot samurai and actual game doesn`t, nice",youtube,국내,en
time to cry under shower while honing,youtube,국내,en
@254trojan ty for proving my point,youtube,국내,en
woooow man,youtube,국내,en
I hope we can cross our data...,youtube,국내,en
what is lyn blade dancer doing in LAO,youtube,국내,en
cool...,youtube,국내,en
Trash,youtube,국내,en
"If this was developed on UE 4, then there's copium for the UE 4 PC update",youtube,국내,en
TIME IS RUNNING. REPENT YOUR SINS TO OUR GOD FATHER JESUS CHRIST AND HE WILL SAVE YOU AND HEAL YOU AND RESTORE YOU.,youtube,국내,en
"@leosilveira1594 BDO has Ninjas and Korean ""samurai"" it's not unlikely",youtube,국내,en
Samurai ayaya?!,youtube,국내,en
new class ayaya,youtube,국내,en
"My dude, have you played lost ark? Stop money-crazed games. Lost ark is the definition of one",youtube,국내,en
"I hope this come to LA on PC lol. 
Samurai / Katana lover's.",youtube,국내,en
Sheeesh,youtube,국내,en
🏦TOPOGRAFICO🏦,youtube,국내,en
"1 year already, what happen?",youtube,국내,en
"Hello, do you know any news about the game? We are in the month of October, thank you very much. 😊",youtube,국내,en
this realy for mobile?,youtube,국내,en
"I'm in love, oh I'm talking about the Katana Loli not LOA Mobile",youtube,국내,en
qwer in mobile  version i cant find in phone qwer,youtube,국내,en
Lostark mobile~! We are so exited about this game!,youtube,국내,en
Toooop 👏🏻👏🏻👏🏻,youtube,국내,en
I love Morai Ruins.,youtube,국내,en
"Yesss, let's goooooo",youtube,국내,en
"hey corean bros, what's the feedback about the game so far?",youtube,국내,en
mas lolis gg con esta wea,youtube,국내,en
"@born2rave270 you haven't played a real p2w games. Take a look at KMS Maplestory or Lineage. Lost ark can be seen as money-crazed game, but to Koreans, it's not compared to western gamers.",youtube,국내,en
I hope they lose money on this.,youtube,국내,en
she literally looks 8..... FBI OPEN TF UP,youtube,국내,en
😊GLOBAL PLEASE😀,youtube,국내,en
CHORA NÃO PC ,youtube,국내,pt
*it looks better lol*,youtube,국내,en
"Good review, bro, but sorry, I'd like to take a small clip of the video, thank you🙏",youtube,국내,en
Is there any trading house in this mobile version?,youtube,국내,en
Yes,youtube,국내,en
I want that class over at official servers. Fingers crossed 🤞,youtube,국내,en
wow a blade and soul class nice,youtube,국내,en
🔥ola boa noite dia tarde🔥,youtube,국내,en
🔥ai ai ai ui ui ui 🔥,youtube,국내,en
Очень красиво,youtube,국내,uk
Please release it global or put some English translation,youtube,국내,en
BR,youtube,국내,en
please release a Nintendo Switch (2?) version!!,youtube,국내,en
"wooow pretty cool new bosses but you can play only if you a korea people, if you not a korea people what you can do just watch people playing.",youtube,국내,en
Блять а почему вы такое на пк версии не хотите сделать а?,youtube,국내,ru
G1 kazaros ?,youtube,국내,en
wait what ??? how you dont have dis in PC version ???,youtube,국내,en
Global ??,youtube,국내,en
😢GLOBAL❤,youtube,국내,en
worldwide release pls! stop do the Korea shit stop scare people not gonna play if you open it only in korea ofc it not enough money to keep continue! stop doing that the world is bigger then korea,youtube,국내,en
This is the sim?,youtube,국내,en
make it together = you can play this ass game only if you are korea.. yeppp cuz the korea market is sooooo big! they can just service on it own 51.71 million and 8.062 billion think more fucking game company ass,youtube,국내,en
"No,  make it fast, pls",youtube,국내,en
😢PLEASE❤,youtube,국내,en
Ffs release it global too.,youtube,국내,en
Still not released in kr,youtube,국내,en
Loskark Never Die,youtube,국내,en
Im playing the game on pc and this trailer made me wanna move to korea just to play this on phone 😂,youtube,국내,en
"smilegate rpg is indeed a joke. travel the same road to failure that blade n soul took, so smart.",youtube,국내,en
hmm better than pc glad i'm quit on pc for 2 years and i think i can continue with lost ark mobile,youtube,국내,en
Lets Goooo,youtube,국내,en
"this isnt lost ark, atleast not what we have in west. its different, style, effect. outside world. went to check few areas, theyre entirely different. characters are done with ai, or with assist, souless. if thats what mobiles games are today, glad im not playing them.",youtube,국내,en
"a trailer with no gameplay, lost ark is dead",youtube,국내,en
Il faudrait que ce soit LA2 sur pc..,youtube,국내,en
Please someone tell the name of the song,youtube,국내,en
I will never play this on Mobile.,youtube,국내,en
just another gacha mmo,youtube,국내,en
Hope the mobile version makes u to progress through the old raids. Would be fun to revisit them. From T1 to T4. But without the unpopular g1s.,youtube,국내,en
هتكسر الدنيا على الموبايل اللعبه,youtube,국내,ar
lets gooooooo  plz don't make same mistakes you made in original PC LostArk 🙏,youtube,국내,en
