selftext,source,region,language
131,dcinside_aion2,국내,en
xx,dcinside_aion2,국내,en
PTSD,dcinside_lostarkm,국내,en
5090,dcinside_lostarkm,국내,en
S25U 16G,dcinside_lostarkm,국내,en
lostark user die,dcinside_lostarkm,국내,en
share,dcinside_lostarkm,국내,en
no sound,dcinside_lostarkm,국내,en
??,inven_lostarkmobile,국내,en
.,inven_lostarkmobile,국내,en
\#FlyHigh #GoneTooSoon,reddit_MMORPG,해외,en
PLEASE RELEASE THIS IN EUROPE TOO!!!!!! ❤❤❤❤❤❤,youtube,국내,en
global when?,youtube,국내,en
"Too much grinding. Another failed KR game like Throne and Liberty. I played more than 50 hours on Taiwan server. The game expected you to grind same expedition, dungeons, raids daily for 100 of times... It's stupid and so boring. Learn from WOW game.",youtube,국내,en
global release now! 🫡,youtube,국내,en
2nd Half Next Year,youtube,국내,en
PAYON2 😂,youtube,국내,en
Global please! 😭,youtube,국내,en
"EVERY game NCSoft made had the same problems, but they don't even try to fix those😂",youtube,국내,en
Jajajajaj😂😂😂😂😂,youtube,국내,en
Помойный релиз,youtube,국내,ru
Heavy p2w game this will not last in NA/EU. These korean devs are really hungry for money lol. Ncsoft just killed the game they created :D,youtube,국내,en
Do not believe  nc soft games they always tricked  us and p2w and that's  not a game just humiliating  of other funny games,youtube,국내,en
My account in Aion 2 was improperly blocked because I supposedly used third-party programs but I just held left mouse button and your company believes that it was macros. Shame on your company for not having any soft detecting real cheaters and blocking honest people!!!,youtube,국내,en
"О сыны двух отцов и дальше рекламируют свой продукт, но забили на остальные и только за вчера было подано более 20тысяч заявок на удаление аккаунтов из-за неадекватных действий службы поддержки. Эта компания лояльна только когда им платят, а ответсвенность за свои косяки брать не хотят. Массово бойкотируйте, они недобросоветные издатели. Даже есть предпосылки об торговле аккаунтами их ""партнеров"" в виде 4ГЕЙм.",youtube,국내,ru
"I'll wait one fucking year to play globally, since NC doesn't want me playing there. Hopefully, I'll lose any desire to play it when the time comes.",youtube,국내,en
One fucking year to be launched globally. 👍,youtube,국내,en
PVP CONTENT IS DEAD BECAUSE OF YOUR NEW UPATE PVP FALG ON/OFF SYSTEM LOL!,youtube,국내,en
永恒之塔2魔族一区卡了不解决吗，今天刚更新还是卡，你们官方看不到吗，上游戏看看。快出退款通道，卡了几天都玩不了,youtube,국내,zh-cn
"abyss points cap, pvp on/off, they are doing everything to make it a bad mobile game full of limitations and boredom.",youtube,국내,en
This game sucks. NC you are a bunch of greedy people. You care nothing about the progress of the game. It will be a great day to see NC go bankrupt.,youtube,국내,en
这游戏走一步卡一步，华人玩家没入坑的还是不要入坑了，官方不作为，魔族一区早上都卡，也不维护解决,youtube,국내,zh-cn
"ok the thing is i dont want to play anymore, as there's workshop massup this game, and NC just DONT CARE",youtube,국내,en
PLease fix you damn server,youtube,국내,en
When comes out on EUROPE,youtube,국내,en
Split the game into a mobile version and a PC version!!!!!!!!!,youtube,국내,en
"с такой скотской политикой к моему ру региону где все недоступно в purple, вы вместо донатящего игрока айона и фэна вашей компании получили хейтера. удачи в продажей китайцам в ближайшие годы",youtube,국내,ru
"Feedback on CBT-1 Aion2: (typically for my favorite class: Elementalist/Spirit Master)
1. Graphics are awesome
2. Gameplay are cool
3. Summons Spirit and the Summoners skills are cool

But,
4. The summoners/main character can't perform any attacks or skills freely until there's an enemy or enemies nearby/targeted
5. The Spirit summons can't attack automatically (not really smart) until the summoner/main character perfoms an attack
6. The Spirit summons are weak, perhaps there're some upgradeable leveling-up

The rest is ok for now. Maybe the other classes combat system also the same as mine. If these suggestions above can be revamped before released then the gameplay will be more attractives and addictives in the future to explore the open-world mmorpg genre. Keep-up the good works. Significantly reduce for phone-user battery savings from overheated. I'm a dedicated mobile player and thank you... ❤️🙏 (Feedback 1st CBT)",youtube,국내,en
"The worst bad launch game i ever see , 90% of player are still stuck with the number phone verification. shame on u no comunication.. and u expect sell u membership p2w , skin ect when there is no support to help us ? Scammer",youtube,국내,en
where did you hide that new map that was supposed to be 32 times bigger?,youtube,국내,en
it's look like dog meat.,youtube,국내,en
"this is so crap game, better not",youtube,국내,en
"Where can i insert the otp code to enter on Aion 2? 
Can't remove all the security options on nc account too :/",youtube,국내,en
LANÇA EM TAIWAN E NÃO LANÇA  NO BRASIL EMPRESA LIXO 🚮,youtube,국내,pt
"Dear Koreans, please tell me about the launch of at least one major game in the world that went off without a hitch.
If a game had no problems, it means no one came to play it.",youtube,국내,en
@user-g1ln7b are you sure? you work there?,youtube,국내,en
Fix your Servers !!! No login possible,youtube,국내,en
"30 минут пытаюсь войти в игру...
Как будто NC новая молодая компания, которая не может предугадать риски",youtube,국내,ru
ok,youtube,국내,en
"близзард тоже не смогли на запусках своих проектов?))
правде в глаза смотрите, невозможен запуск без проблем.",youtube,국내,ru
"Yes, the company is also taking into account this, and blizzard is completely far away from the developers and has reached a dead end, like other games since undecember, attempts have already been made to make games not in the style of action, but in the style of an mmorpg with an isometric view. Too many action games have become in games",youtube,국내,en
17 سنه ☠️,youtube,국내,fa
When will the game is ready for global user?,youtube,국내,en
5 days left guys!,youtube,국내,en
global,youtube,국내,en
"I know you need the money NC, but remember that the moment players gain advantage from spending money, that your game will die.",youtube,국내,en
GLOBAL RELEASE 2025 WHY CANT YOU RELEASE AT THE SAME TIME WITH SAME PATCH LIKE FF14,youtube,국내,en
Is there any direct channel to the game team? Devs or someone similar?,youtube,국내,en
"I wish to plead for NCSoft for a little more respect to the global fanbase.
I don't even live in a country where English is the native language (and I recognize the privilege of knowing English and a bit of Spanish, which lets me enjoy almost 100% of the games that get released). I just wanted to be able to understand what's written on the website without having to use a translator that always messes everything up when trying to translate any Eastern ideogram. NCSoft  should have made this global from the start. Aion has fans all over the world. It's not fair.",youtube,국내,en
WHERE'S THE GLOBAL SITE IN ENGLISH???? 😭😭😭😭,youtube,국내,en
pls make a global release soon :( qe need it,youtube,국내,en
Y'all aren't going to make an impact in the global market at all with this monetization. There are free and paid games out there without all all these subscriptions etc that do very well. Where Winds Meet is a free game that only has the 2 battle passes like normal and NO subscription or P2W or Pay for convenience. Y'all gonna have to redo this for global market or it'll just fail. Havent you guys seen that this type of aggressive monetization doesn't work in America? Why keep doing it,youtube,국내,en
"For global sorcerers, consider that our class was showcased with lv12 skills, others was lv20",youtube,국내,en
This is just the same stream you showed the other day,youtube,국내,en
Do you need a korean phone number to register like other games or is it playable with VPN?,youtube,국내,en
Definitely go on a private server that has Aion 3.0 server or 4.0 server,youtube,국내,en
Where global?,youtube,국내,en
Maybe EU and NA,youtube,국내,en
Все анимации из л2м,youtube,국내,ru
mmorpgs are not that popular anymore + no global release yet,youtube,국내,en
Fail in the making! PVE MORE 😞,youtube,국내,en
October 2026,youtube,국내,en
2026 4/4 soon,youtube,국내,en
"@uravghuman Damn almost a year... I can't accept that, I have to play now!",youtube,국내,en
"@markpetrochenko8402 It's not factual tho, just my/the community's best guess based on the usual delay from NCsoft games.",youtube,국내,en
@uravghuman I think it might be a end of the Spring or a begining of Summer,youtube,국내,en
2026 3~4 quater,youtube,국내,en
"Let’s go Ncsoft! Bring back the magic that Aion gave us in the beginning. Show everyone who never played Aion how amazing this game is.
I know Aion 2 will be different from the first one, but that doesn’t mean it will be bad. You have the potential to create something incredible, just like you did once before.",youtube,국내,en
"Please, protect Aion initial history.",youtube,국내,en
"Please, we need the global server up as soon as possible! Children are crying!!! 😢😢😢😢😢",youtube,국내,en
"Waiting hard on west release!! ❤ Played 6 years on Aion 1, can’t wait to come back! Looks promising, dont break our ❤",youtube,국내,en
if they get the subscrition $15 and under,youtube,국내,en
looks way worse than the gameplay what we saw until now. should be the opposite xd,youtube,국내,en
maybe next year -  year end? hahahah   i'm korean!!!!!!!!!!!!!!!!!!!!!!! hahahahahahahah   lol,youtube,국내,en
"Oh no, they will add gunner and pilot here too 😢😢😢",youtube,국내,en
global is set for second half of 2026,youtube,국내,en
GLOBAL BRAZIL 😍,youtube,국내,en
"Le di como 15 años de mi vida a este juego, realmente increible.",youtube,국내,es
They said 2070 runs max stat,youtube,국내,en
Ya quiero ver el global para cuando será.,youtube,국내,es
they need to chill with the monthly 50 bucks stuff,youtube,국내,en
So when we can play this?,youtube,국내,en
"The game is definitely beautiful, but guys, please, fix de ""ice skating"" of the characters when moving. Movement in TL is so smooth, I don't understand why a game that comes after from the same Company is worse in this aspect.",youtube,국내,en
"Advanced Technology in a fantasy world is pretty cool, lets go.",youtube,국내,en
Will this mmorpg dethrone throne and liberty? 🤔,youtube,국내,en
Can't wait to play the story 💜,youtube,국내,en
Global when ? Hope aion 2 wont be like hard p2w aion 1,youtube,국내,en
Погнали(но не мы),youtube,국내,ru
Auctionhouse behind paywall=bullshit,youtube,국내,en
Can't wait to sell my kidney just to be able to afford playing this game...,youtube,국내,en
"comentario en español que de seguro busca, se ve bueno, pero preparen su tarjeta (no de video) para jugarlo xd",youtube,국내,es
"it's that hard to make games as before? I mean, those times were games by gamers. Now it looks like games for whales by greedy ppl",youtube,국내,en
cuanto para el global lptm,youtube,국내,en
great 😎,youtube,국내,en
"PLEASE, we need the global release ASAP. You guys are losing money by not releasing it here",youtube,국내,en
"Any news about pre-download for the mobile version? Actually, there's very little information for mobile... and see if you can release this global version in the first half of the year...I really wanted to understand why the delay, a sincere question.",youtube,국내,en
You can play for free without using the exchange.,youtube,국내,en
2027 global,youtube,국내,en
Trailer hmm,youtube,국내,en
"If skills looks horrible and fighting, no point to play this",youtube,국내,en
Global release fast pls :(,youtube,국내,en
1:12 that sounded Russian at first 😅,youtube,국내,en
Flying scifi airplanes?!!! This is not Aion: (,youtube,국내,en
"Ffs, no spaceships, no motorbikes, no schooluniforms, etc. Wtf, man.",youtube,국내,en
So what happened to the Balaur in aion? and are Elyos and Asmodians still a thing?,youtube,국내,en
هل جسدكم مستعد لمغامره ايون ٢؟,youtube,국내,ar
Same,youtube,국내,en
"lol i have Final Fantasy vibe, like a old FF games......very very waiting A2",youtube,국내,en
sortez le jeu rapidement en europe svp :),youtube,국내,en
Polearm when,youtube,국내,en
"I still play throne and I don't like to see games fall. But I would say so unfortunately. 
The combat has such similar feeling that I'd say they used a log of resources from throne there. Or atleast the concepts and probably improved what was lacking. 
We will see then, but it's the ideia I have. And unfortunately throne is struggling with player count",youtube,국내,en
Need gloval relise all ppl wait it,youtube,국내,en
Dinguerie,youtube,국내,en
A comunidade da América Latina precisa se unir e lutar para conseguir um servidor no SA. O jogo promete ser um dos melhores MMORPGs.,youtube,국내,pt
I'm going to cry as soon as I start playing — it looks absolutely incredible... totally like a movie. Such a beauty for the eyes 🥺💖,youtube,국내,en
"You're not looking at this right, look at these awful graphics for 2025, smartphone graphics. If they release this crap like this, it'll be another game that won't surpass Black Desert. I hope the game is as bad as the video shows.",youtube,국내,en
"What a shame! It seems we're going to have another game that won't be able to surpass Black Desert. It's impossible for that to happen again in 2025. That's not going to happen! It can't be! I can't stand Black Desert anymore, help!!!",youtube,국내,en
Battlepass 2,youtube,국내,en
THIS IS NOT AION....,youtube,국내,en
"They stated even lower spec, but for comfort only real tests can tell.",youtube,국내,en
GREND OPENN! -6,youtube,국내,en
"Мы теперь в резервации, вряд ли к нам вообще хоть что-нибудь доедет.",youtube,국내,ru
Brawler class please release very fast,youtube,국내,en
"In the Aion universe there have always been elements of technology: ancient mechanisms, flying ships, gunners and robots.",youtube,국내,en
Play on Taiwan server like everyone else,youtube,국내,en
just find a better job,youtube,국내,en
​@grayhairs6292and why would he play mmorpg then?,youtube,국내,en
"I guess everyone's an elyos now, or this story is set way back before the races even split into two. also the gameplay is very TERA/B&S, the latter also being one of NCsoft's creations.",youtube,국내,en
"do better, asmo are there",youtube,국내,en
@MASHleZeroSkillPlay but they have no difference from ely,youtube,국내,en
@MASHleZeroSkillPlay so what's the difference? everyone looks pretty,youtube,국내,en
"​@converserso, what's you point? Why do you think there must be a huge difference to be opposite? Why America went to war for independence while there was no difference between them and brits?",youtube,국내,en
"​@rosst2000 You're bringing up weird analogies, but you do agree there are indeed differences but yet you won't answer the question. It's a legit question and yet people are getting upset for some reason.",youtube,국내,en
Ouuuu mamaaaaaa!,youtube,국내,en
Mobile slop,youtube,국내,en
"Yeah, that's it. Millions of bad and stupid players taught devs to make games like that. If ppl eagerly pay for literally everything so why don't milk them.",youtube,국내,en
this,youtube,국내,en
It’s already dead my friend. Aion 2 is some kind of joke,youtube,국내,en
"I wish they did, but im afraid it will not be the case, im not even sure if there's elyos and asmodians, they look the same now",youtube,국내,en
because it will be expansive for europians,youtube,국내,en
Entrance fee = Exchange use     13$ = korea,youtube,국내,en
​@handphone80$ for human players,youtube,국내,en
"@hanskrans8937 it’s not 50. 
You don’t HAVE to buy extra sub and bp.",youtube,국내,en
"@miaou5878 That can be dangerous. Remember that koreans think that 30$ monthly for a game you play every day is ""cheap"", and starting +70 is expensive. They need to change monetization before international release",youtube,국내,en
وللللعت,youtube,국내,ar
"i thought i was tripping, thank you",youtube,국내,en
@handphone faak youuuuuuu,youtube,국내,en
go for Taiwan server first by using gaming VPN,youtube,국내,en
"Ncsoft, there are still people who believe in your work here.
Please be careful with Aion 2 monetization, let’s make it run well for many years.
Aion has been and still is a big part of many people’s lives.
So let’s do things right.
Show all the haters you’re making the best MMORPG out there.",youtube,국내,en
I want our Korean gamer friends to be very serious and honest when it comes to reviewing the full game.,youtube,국내,en
"You are aware they won't do anything about it, right? Ncsoft knows their games fail cause of predatory monetization and updates becoming always more focus on buying power, rather than playing for it",youtube,국내,en
"So excited, can't wait to play! 💜",youtube,국내,en
PLEASE NC SOFT REMOVE THE ABYSS TIMER!! I WANT TO DO PVP IN ABYSS!! REMOVE THE 7 HOUR / WEEK TIMER!! ❤❤❤,youtube,국내,en
"Ncsoft can always come back to old type of BM when every one was happy and it is - you buy game and subscription for 1,3,6,9,12 months with progressively economically effectiveness(for longer you buy less it costs per month)",youtube,국내,en
"Please make from the chanter the power PvP class.
This class is the pearl of the game:3",youtube,국내,en
"they already stated in an investor call that the strategy will be no p2w for some time to gain reputation, then ramp up the p2w once the audience is large.
they said that",youtube,국내,en
We still love Aion. That why we hate NC soft.,youtube,국내,en
Your greed will be your downfall. Wtf are 2 monthly +50 dollar subscriptions ???,youtube,국내,en
很好看,youtube,국내,zh-cn
什么时候开始,youtube,국내,zh-cn
Is it coming world wide or?,youtube,국내,en
global or just in korea?,youtube,국내,en
WHERE IS THE GLOBAL SITE IN ENGLISH? 😭😭😭😭😭,youtube,국내,en
Plz have controller support at launch!!!,youtube,국내,en
Noice English 😊,youtube,국내,en
No P2W please,youtube,국내,en
When is this game coming to EUROPE!? PLEASE!!!!!😢😢😢😢,youtube,국내,en
last hope,youtube,국내,en
"Was that Yustiel, right there?",youtube,국내,en
😮GLOBAL NO😮,youtube,국내,en
if AION 2 is another Throne & Liberty... let's pray together 🙏🏻,youtube,국내,en
MALE VOICE!! VAAAMOOOS!!,youtube,국내,en
waiting for you ,youtube,국내,en
No P2W!!!!,youtube,국내,en
"@tryingtopottery4052 if they could they probably would

the shareholders are in charge, just like any other public company
i hope they can start waking up cause that stock price has been a downfall for a while now",youtube,국내,en
"​@yaitaribecause that's the business model, make an mmo for 300M then p2w it for profit.
except it hasn't been working  as their stock price is a proof of that.
this is the sole reason they might change their business model, that and the new co-CEO",youtube,국내,en
"Come on, NCSoft, prove to the world that you can still bring back the joy and emotions we all felt in the golden days of Aion 1.!",youtube,국내,en
Fix the 2 subs into 1 single sub with a reasonable price and we're talking! <3,youtube,국내,en
nah this is pure P2W game and it have 2 subscription lol,youtube,국내,en
PLEASEEEEEEEEEE both pve and pvp but never forced pvp!! 🙏🏼🙏🏼🙏🏼🙏🏼,youtube,국내,en
"I wish to plead for NCSoft for a little more respect to the global fanbase.
I don't even live in a country where English is the native language (and I recognize the privilege of knowing English and a bit of Spanish, which lets me enjoy almost 100% of the games that get released). I just wanted to be able to understand what's written on the website without having to use a translator that always messes everything up when trying to translate any Eastern ideogram. NCSoft  should have made this global from the start. Aion has fans all over the world. It's not fair.",youtube,국내,en
That's a must,youtube,국내,en
Yea especially west community but because they didn't cover it clearly everyone is going crazy about the membership,youtube,국내,en
PvP >> PvE,youtube,국내,en
P2W worst Pvp ever i ve seen. Dont come Europe with this.,youtube,국내,en
FIX FLIGHT METER; IDIOTS,youtube,국내,en
what you did to this game...pay to auction broker?..i..,youtube,국내,en
incroyable !,youtube,국내,en
AION2 ヘッチャラ！,youtube,국내,ja
"I'll just wait a private server and pay there 5 USD a month then give this guy's my money, why the fuk don't they ask 60-80 USD to buy the game and cosmetics and stuff separately?",youtube,국내,en
"Dear NCSoft,
As a longtime Aion fan, I'm eagerly awaiting Aion 2. However, the absence of trading stalls is disappointing for me and many other players. They were a vital part of the social and economic life in the original game. Stalls created a bustling market atmosphere, encouraged player interaction, and helped us find rare items. Please consider bringing this feature back. It would make the world of Aion 2 feel more alive and engaging. Thank you for your consideration.",youtube,국내,en
Pls make Chanter a good DPS class! He is the pearl of this game!,youtube,국내,en
"add more p2w please, we need more battle passes, you have not learned anything from your mistakes with aggressive monetization",youtube,국내,en
please keep factions of asmodian and elyos!!!!,youtube,국내,en
You're making a big mistake for releasing it first for PC/mobile PC/Console as there's more people with consoles than phones that can launch games like that . Bad marketing choice,youtube,국내,en
good game but only server kr we dont have server global so i dont care now me and my guild,youtube,국내,en
"This will be extreme P2W greedy mobile cashgrab... unfortunately. I loved first Aion after release. It was best game I ever played, but gradually became more and more P2W and color, rainbow, carrot weapon brainrot.",youtube,국내,en
❤ GLOBAL BRAZIL PLEASE ❤7,youtube,국내,en
Private servers will do the right things,youtube,국내,en
after the subscription model the game is doomed on arrival.,youtube,국내,en
NcSoft is GOLDDIGER ;),youtube,국내,en
Когда она выйдет на СНГ?🤔,youtube,국내,ru
"bosses need to deal more damage, make the healer class playable please",youtube,국내,en
Global server without region lock please,youtube,국내,en
Kaisinnel ❤❤❤❤❤❤,youtube,국내,en
Arieluma!,youtube,국내,en
"What version of Unreal engine 5 will game use ?
What's the fps lock ?",youtube,국내,en
"Come on, NCSoft, show the world that you still have what it takes. Bring back the magic and the emotions we felt in the best days of Aion 1. We believe in your potential to make it shine once again.",youtube,국내,en
Cant wait for the western release !!!,youtube,국내,en
True I'm amazed when I first play the game. Nothing can ever replace the feeling on that time.,youtube,국내,en
The west's hype is growing and growing! 🤯,youtube,국내,en
Let's go!! 👌🔥,youtube,국내,en
"they will dance again with so many new MMORPGs after Aion2. 
Project E, Guild Wars 3, and more
NCsoft are always the best creators of virtual worlds.",youtube,국내,en
"""The Last Game of My Life""",youtube,국내,en
"Sad part nothing compare to Aion 1,less pvp",youtube,국내,en
FOR ASMODAE,youtube,국내,en
I cannot understand any of these.,youtube,국내,en
"so many new MMORPGs coming after Aion2. it's not the last chance
Project E, Guild Wars 3, and more
NCsoft are always the best creators of virtual worlds.",youtube,국내,en
"Hi! Can you please tell us, westerners, what is that joke which translates to English as “the younger one was deceived”?
I see it a lot under ncsoft videos from Koreans, but can’t understand 😅",youtube,국내,en
EL hype es real!,youtube,국내,en
true,youtube,국내,en
asin bayraklari,youtube,국내,en
❤ GLOBAL BRAZIL PLEASE ❤9,youtube,국내,en
"Сделайте перевод интерфейса на русский, пожалуйста!)
Обязательно зайду и куплю все подписки!)",youtube,국내,ru
Can’t wait !!!!,youtube,국내,en
